{
  "$schema": "../../schema/skin.schema.json",
  "id": "paper-dawn",
  "name": "Paper Dawn",
  "nameZh": "宣纸晨",
  "version": "1.0.0",
  "author": "grok-bot-skin",
  "license": "CC-BY-4.0",
  "description": "宣纸底、朱砂日。浅色 Appearance 下用，聊天区保持留白。",
  "compatible": { "app": "Grok Bot", "minVersion": "0.78.0" },
  "appearance": "light",
  "bot": {
    "avatar": "assets/avatar.jpg",
    "accent": "#c45c26",
    "suggestedLabel": "Dawn",
    "generatePrompt": "Centered emblem of a round cinnabar sun over two simple vermillion hills, filling most of the square for a circular crop. Warm cream rice-paper background edge to edge. Limited palette of cream, apricot, and cinnabar. No frame, no text, no logo."
  },
  "chrome": {
    "wallpaper": "assets/wallpaper.jpg",
    "wallpaperOpacity": 0.42,
    "tokens": {
      "text": "#2c2418",
      "muted": "#6f6454",
      "chrome": "#f3ead9",
      "sidebar": "#eee3cc",
      "pane": "#f7f1e4",
      "accent": "#c45c26",
      "border": "#d9cbb0"
    }
  }
}
