{
  "$schema": "../../schema/skin.schema.json",
  "id": "leaf-warm",
  "name": "Leaf Warm",
  "nameZh": "木叶暖",
  "version": "1.1.0",
  "author": "grok-bot-skin",
  "license": "Fan-art — see README",
  "description": "浅色卡通忍者村：鸣人和九尾各占一侧，中间留给聊天。护额、螺旋丸、拉面和青蛙点缀窗角。",
  "descriptionEn": "Light ninja village: Naruto and Kurama at the sides, the village in the middle for chat.",
  "compatible": { "app": "Grok Bot", "minVersion": "0.78.0" },
  "appearance": "light",
  "bot": {
    "avatar": "assets/avatar.jpg",
    "accent": "#e09a5a",
    "suggestedLabel": "Leaf"
  },
  "chrome": {
    "wallpaper": "assets/wallpaper.jpg",
    "wallpaperOpacity": 0.5,
    "tokens": {
      "text": "#4a3f34",
      "muted": "#8a7664",
      "chrome": "#fff4e6",
      "sidebar": "#ffe3c6",
      "pane": "#fffaf2",
      "accent": "#e09a5a",
      "border": "#edcda8"
    }
  }
}
