{
  "$schema": "../../schema/skin.schema.json",
  "id": "straw-sea",
  "name": "Straw Sea",
  "nameZh": "草帽海",
  "version": "1.0.0",
  "author": "grok-bot-skin",
  "license": "CC-BY-4.0",
  "description": "浅色卡通航海：奶油、草帽金、珊瑚粉和海水蓝。明亮但不刺眼，窗角有帽子、波浪和星星点缀。",
  "compatible": { "app": "Grok Bot", "minVersion": "0.78.0" },
  "appearance": "light",
  "bot": {
    "avatar": "assets/avatar.jpg",
    "accent": "#e08a6a",
    "suggestedLabel": "Sea"
  },
  "chrome": {
    "wallpaper": "assets/wallpaper.jpg",
    "wallpaperOpacity": 0.38,
    "tokens": {
      "text": "#4a3d32",
      "muted": "#8a7364",
      "chrome": "#fff6ea",
      "sidebar": "#ffe9d2",
      "pane": "#fffaf3",
      "accent": "#e08a6a",
      "border": "#f0d2b8"
    }
  }
}
